{
  "$schema": "https://json-schema.org/draft/2020-12/schema",
  "$id": "https://q2d.dev/conformance/vector.schema.json",
  "title": "Q2D conformance vector (authored form)",
  "description": "The authored vector, carrying both halves. P-001 §4.4 defines the format; this schema is its machine-checkable statement. The input-only projection a runner receives is P-001 §4.2 and P-001 issue 2 — implementations never see a file matching this schema.",
  "type": "object",
  "additionalProperties": false,
  "required": ["id", "section", "requirement", "description", "operation", "input", "expect"],
  "properties": {
    "id": {
      "description": "Stable identifier, lowercase kebab segments separated by '/'. The first segment repeats 'section'; the harness checks the two agree and that the file sits under a directory of that name.",
      "type": "string",
      "pattern": "^[a-z0-9]+(-[a-z0-9]+)*(/[a-z0-9]+(-[a-z0-9]+)*)+$"
    },
    "section": {
      "description": "Corpus section. Closed, and extended additively by the PRD that owns the new section — the same discipline P-001 §4.5 applies to the operation vocabulary, and for the same reason: a typo must not create a section.",
      "type": "string",
      "enum": [
        "message",
        "suite",
        "replay",
        "registry",
        "domain",
        "policy",
        "budget",
        "denial",
        "ordering",
        "evaluate",
        "validate",
        "pipeline",
        "receipt",
        "requester",
        "binding",
        "identity",
        "escalation",
        "demo",
        "adversarial"
      ]
    },
    "requirement": {
      "description": "What this vector exercises. Mandatory with no default: P-001 §4.4 makes it what turns the corpus into a live traceability matrix, and a vector citing nothing is rejected by the linter. Each entry is a claim identifier from spec/claims.md, a conformance class from spec/conformance-classes.md, or a 'file.md#section' citation into spec/ or threat-model/. The harness checks that every entry resolves, including that the cited section exists and not merely the file.",
      "type": "array",
      "minItems": 1,
      "items": {
        "type": "string",
        "pattern": "^(Q2D-(C|NC)-[0-9]{2}|CC-[0-9]{1,2}|[a-z0-9-]+\\.md#[0-9]+(\\.[0-9]+)*)$"
      }
    },
    "description": {
      "description": "One sentence, for the reader deciding whether the vector says what it claims to. A vector nobody can review is a vector nobody can trust.",
      "type": "string",
      "minLength": 1
    },
    "operation": {
      "description": "From the closed vocabulary in P-001 §4.5. Stages 5-8 extend this list, as one coordinated change, under P-001 issue 17 — the names anticipated there are proposals, not decisions, so they are deliberately absent here. An operation a runner does not recognise is exit 1, never a skip.",
      "type": "string",
      "enum": [
        "sign_query",
        "sign_response",
        "verify_query",
        "verify_response",
        "digest",
        "resolve_predicate",
        "effective_domain",
        "capacity_debit",
        "policy_decide",
        "evaluate_predicate",
        "process_query"
      ]
    },
    "input": {
      "description": "Everything the operation needs, including every value that would otherwise vary: keys, nonces, issued_at, expires_at, identifiers. P-001 §4.3 — a runner that reads a clock or generates a nonce is non-conforming.",
      "type": "object"
    },
    "expect": {
      "description": "What a conforming implementation produces. The harness strips this before writing the file a runner reads (P-001 §4.2). Only 'ok' and 'rejected' may be expected: 'error' is a runner-reported outcome (P-001 §6) meaning the runner faulted, and an internal error is never a passing result.",
      "type": "object",
      "oneOf": [
        {
          "description": "The operation succeeds.",
          "type": "object",
          "additionalProperties": false,
          "required": ["outcome", "output", "comparison"],
          "properties": {
            "outcome": { "const": "ok" },
            "output": {
              "description": "Any JSON value. Its shape is the operation's, not this schema's."
            },
            "comparison": {
              "description": "'bytes' where the spec requires determinism, 'semantic' where it does not. Stated per vector with no default, because a silent default is how a determinism requirement gets quietly dropped (P-001 §4.4). 'semantic' is parse-then-deep-equal and applies to unsigned material only; anything inside 'signed' compares as bytes.",
              "enum": ["bytes", "semantic"]
            }
          }
        },
        {
          "description": "The implementation rejects the input. A successful run that reports a rejection, never a runner failure (P-001 §4.1).",
          "type": "object",
          "additionalProperties": false,
          "required": ["outcome", "rejection", "comparison"],
          "properties": {
            "outcome": { "const": "rejected" },
            "rejection": {
              "description": "Both halves, because the harness checks both (P-001 §4.6). The internal reason is what an implementation records locally; the wire response is what a requester receives.",
              "type": "object",
              "additionalProperties": false,
              "required": ["internal_reason", "wire"],
              "properties": {
                "internal_reason": { "type": "string", "minLength": 1 },
                "wire": { "type": "object" },
                "step": {
                  "description": "The core-model.md §4 step at which rejection occurred. Optional in general, and how the ordering/ section asserts ordering without instrumenting the implementation. An integer for a numbered step, or one of the lettered steps §4's table defines -- today only 9a, the rate-limit check. Closed rather than patterned, for the reason the operation vocabulary is closed: a vector citing step 12b would otherwise assert an ordering the specification does not have.",
                  "oneOf": [
                    { "type": "integer", "minimum": 1, "maximum": 19 },
                    { "enum": ["9a"] }
                  ]
                }
              }
            },
            "comparison": {
              "description": "As above. A normalized denial compares as bytes: P-001 §4.8's cross-vector assertion needs the wire response to be byte-identical across causes.",
              "enum": ["bytes", "semantic"]
            }
          }
        }
      ]
    }
  }
}
