{
  "id": "ordering/step-12/contract-broader-than-the-entry",
  "section": "ordering",
  "requirement": [
    "core-model.md#4",
    "core-model.md#5.2.1",
    "CC-2"
  ],
  "description": "An answer contract requesting a `scalar` where the entry's registered release shape is `boolean` — broader than the entry permits, which Q2D-C-02 refuses. After step 11, because a contract is judged against an entry that has been resolved and whose public context has been validated.",
  "operation": "process_query",
  "input": {
    "envelope": {
      "signed": "eyJrZXlfaWQiOiJ0ZXN0LXJlcXVlc3Rlci0xIiwic3VpdGUiOiJlZGRzYS1qd3MtMjAyNiJ9.eyJhbnN3ZXJfY29udHJhY3QiOnsiYWxsb3dlZF9kZXRhaWxfZmllbGRzIjpbXSwiZG9tYWluIjpbZmFsc2UsdHJ1ZV0sInJlbGVhc2Vfc2hhcGUiOiJzY2FsYXIifSwiZGVsaXZlcnkiOnsiYW5zd2VyX3JlY2lwaWVudCI6ImRpZDprZXk6ejZNa1JlcXVlc3RlclJ1bnRpbWUiLCJwZXJtaXR0ZWRfc2lua3MiOlsidXJuOnEyZDpzaW5rOm1vZGVsOmxvY2FsIl19LCJleHBpcmVzX2F0IjoiMjAyNi0wNy0zMVQwOTowNTowMFoiLCJpc3N1ZWRfYXQiOiIyMDI2LTA3LTMxVDA5OjAwOjAwWiIsIm5vbmNlIjoiVXg3a0ZRMm1TMGFWdkoxY1B6TjRidyIsInByZWRpY2F0ZSI6eyJpZCI6Imh0dHBzOi8vcTJkLmRldi9wcmVkaWNhdGVzL2RpZXRhcnkvbWVudS1jb21wYXRpYmxlIiwicHVibGljX2NvbnRleHQiOnsibWVudSI6W3siY29udGFpbnMiOlsibWlsayJdLCJpdGVtX2lkIjoicmlzb3R0byJ9LHsiY29udGFpbnMiOltdLCJpdGVtX2lkIjoic2FsYWQifV19LCJyZWdpc3RyeV9kaWdlc3QiOiJzaGEyNTY6YmQwOGZmMjMwZGUwZDhjZTM0ZGU5OTk2N2Y3YTkwOTc5ODhiNDkwNThmMGEyMWRkMzViOTQ0NGMyNDA5OGUzNSIsInZlcnNpb24iOiIwLjEifSwicHVycG9zZSI6eyJjb2RlIjoic29jaWFsLm1lYWwtcGxhbm5pbmciLCJkZXNjcmlwdGlvbiI6IkNob29zZSBhIGRpbm5lciB2ZW51ZSBmb3IgMjAyNi0wNy0zMSJ9LCJxMmRfdmVyc2lvbiI6IjAuMSIsInF1ZXJ5X2lkIjoidXJuOnV1aWQ6MGUxODMzODktMGYzNy00YzVmLThjNTYtMWVhN2U1ODE4ZTE4IiwicmVxdWVzdGVyIjp7ImFnZW50IjoiZGlkOmtleTp6Nk1rUmVxdWVzdGVyQWdlbnQiLCJkZWxlZ2F0aW9uIjp7InByb2ZpbGUiOiJsb2NhbC1wYWlyaW5nLTAuMSIsInJlZmVyZW5jZSI6InNoYTI1Njo3ZWYxIn0sInByaW5jaXBhbCI6ImRpZDprZXk6ejZNa1JlcXVlc3RlclByaW5jaXBhbCJ9LCJzaWduYXR1cmUiOnsia2V5X2lkIjoidGVzdC1yZXF1ZXN0ZXItMSIsInByb2ZpbGUiOiJlZGRzYS1qd3MtMjAyNiJ9LCJ0YXJnZXQiOnsiY3VzdG9kaWFuIjoiaHR0cHM6Ly9mcmllbmQuZXhhbXBsZS8ud2VsbC1rbm93bi9xMmQifSwidHlwZSI6InF1ZXJ5In0.i9S0njhEBiVwU1nBjjNTrzxrIy5MWCDsOTaKjQivwlXPT30vCGbtrUrEtiK3q_EVnCjRXdMS3EvZQnHTlFEdAw"
    }
  },
  "expect": {
    "outcome": "rejected",
    "rejection": {
      "internal_reason": "contract_not_narrowable",
      "wire": {
        "status": "deny",
        "external_reason": "unavailable"
      },
      "step": 12
    },
    "comparison": "bytes"
  }
}
