{
  "id": "denial/escalation/explicit",
  "section": "denial",
  "requirement": [
    "Q2D-C-10",
    "core-model.md#5.3"
  ],
  "description": "An explicit escalation missing the two fields §5.3 gives it. Under §5.2's list it would have looked merely unusual; under its own it is incomplete.",
  "operation": "process_query",
  "input": {
    "cause": "budget_exhausted"
  },
  "expect": {
    "outcome": "rejected",
    "rejection": {
      "internal_reason": "policy_escalate",
      "wire": {
        "status": "escalate",
        "receipt": {
          "request_digest": "sha-256:0000000000000000000000000000000000000000000000000000000000000000",
          "decision_class": "escalate",
          "decided_at": "2026-01-01T00:00:00Z",
          "responder": "did:example:test-custodian-1",
          "signature_suite": "eddsa-jws-2026"
        },
        "signature": "zzzzzzzzzzzzzzzzzzzzzzzzzzzzzzzzzzzzzzzzzzzzzzzzzzzzzzzzzzzzzzzzzzzzzzzzzzzzzzzzzzzzzz"
      }
    },
    "comparison": "bytes"
  }
}
