{
  "id": "ordering/step-1/signed-is-not-a-compact-serialization",
  "section": "ordering",
  "requirement": [
    "core-model.md#4",
    "core-model.md#5.2.1",
    "CC-2"
  ],
  "description": "An envelope whose `signed` is not three dot-separated base64url segments. Step 1 parses the envelope before any allocation on attacker-controlled data, so this is refused before a suite is read or a key resolved — nothing below step 1 runs.\n\nIt does **not** cover a transport delivering bytes that are not JSON at all: a vector file is JSON and a runner is handed a parsed object, so that case cannot travel through this corpus. It belongs to the binding that owns framing ([P-013](../docs/prds/P-013-https-binding.md)).",
  "operation": "process_query",
  "input": {
    "envelope": {
      "signed": "not-a-compact-serialization"
    },
    "environment": {
      "now": "2026-07-31T09:01:00Z"
    }
  },
  "expect": {
    "outcome": "rejected",
    "rejection": {
      "internal_reason": "envelope_malformed",
      "wire": {
        "status": "deny",
        "external_reason": "malformed"
      },
      "step": 1
    },
    "comparison": "bytes"
  }
}
