{
  "id": "message/envelope/routing-string-past-the-limit",
  "section": "message",
  "requirement": [
    "core-model.md#2.8"
  ],
  "description": "A `target.custodian` in `routing` of 2123 bytes, past §2.8's 2 KiB. The limit reaches `routing` because `routing` is a protocol structure whose fields the specification names — and it does not reach `signed`, which is a whole JWS compact string and would not fit inside 2 KiB for any real query. The envelope as a whole is far below 64 KiB, so this is the string limit and not the envelope's.",
  "operation": "verify_query",
  "input": {
    "envelope_bytes_base64url": "eyJyb3V0aW5nIjp7ImV4cGlyZXNfYXQiOiIyMDI2LTA3LTMxVDA5OjA1OjAwWiIsInByZWRpY2F0ZSI6eyJpZCI6Imh0dHBzOi8vcTJkLmRldi9wcmVkaWNhdGVzL2RpZXRhcnkvbWVudS1jb21wYXRpYmxlIiwidmVyc2lvbiI6IjAuMSJ9LCJxMmRfdmVyc2lvbiI6IjAuMSIsInRhcmdldCI6eyJjdXN0b2RpYW4iOiJodHRwczovL2ZyaWVuZC5leGFtcGxlL3BwcHBwcHBwcHBwcHBwcHBwcHBwcHBwcHBwcHBwcHBwcHBwcHBwcHBwcHBwcHBwcHBwcHBwcHBwcHBwcHBwcHBwcHBwcHBwcHBwcHBwcHBwcHBwcHBwcHBwcHBwcHBwcHBwcHBwcHBwcHBwcHBwcHBwcHBwcHBwcHBwcHBwcHBwcHBwcHBwcHBwcHBwcHBwcHBwcHBwcHBwcHBwcHBwcHBwcHBwcHBwcHBwcHBwcHBwcHBwcHBwcHBwcHBwcHBwcHBwcHBwcHBwcHBwcHBwcHBwcHBwcHBwcHBwcHBwcHBwcHBwcHBwcHBwcHBwcHBwcHBwcHBwcHBwcHBwcHBwcHBwcHBwcHBwcHBwcHBwcHBwcHBwcHBwcHBwcHBwcHBwcHBwcHBwcHBwcHBwcHBwcHBwcHBwcHBwcHBwcHBwcHBwcHBwcHBwcHBwcHBwcHBwcHBwcHBwcHBwcHBwcHBwcHBwcHBwcHBwcHBwcHBwcHBwcHBwcHBwcHBwcHBwcHBwcHBwcHBwcHBwcHBwcHBwcHBwcHBwcHBwcHBwcHBwcHBwcHBwcHBwcHBwcHBwcHBwcHBwcHBwcHBwcHBwcHBwcHBwcHBwcHBwcHBwcHBwcHBwcHBwcHBwcHBwcHBwcHBwcHBwcHBwcHBwcHBwcHBwcHBwcHBwcHBwcHBwcHBwcHBwcHBwcHBwcHBwcHBwcHBwcHBwcHBwcHBwcHBwcHBwcHBwcHBwcHBwcHBwcHBwcHBwcHBwcHBwcHBwcHBwcHBwcHBwcHBwcHBwcHBwcHBwcHBwcHBwcHBwcHBwcHBwcHBwcHBwcHBwcHBwcHBwcHBwcHBwcHBwcHBwcHBwcHBwcHBwcHBwcHBwcHBwcHBwcHBwcHBwcHBwcHBwcHBwcHBwcHBwcHBwcHBwcHBwcHBwcHBwcHBwcHBwcHBwcHBwcHBwcHBwcHBwcHBwcHBwcHBwcHBwcHBwcHBwcHBwcHBwcHBwcHBwcHBwcHBwcHBwcHBwcHBwcHBwcHBwcHBwcHBwcHBwcHBwcHBwcHBwcHBwcHBwcHBwcHBwcHBwcHBwcHBwcHBwcHBwcHBwcHBwcHBwcHBwcHBwcHBwcHBwcHBwcHBwcHBwcHBwcHBwcHBwcHBwcHBwcHBwcHBwcHBwcHBwcHBwcHBwcHBwcHBwcHBwcHBwcHBwcHBwcHBwcHBwcHBwcHBwcHBwcHBwcHBwcHBwcHBwcHBwcHBwcHBwcHBwcHBwcHBwcHBwcHBwcHBwcHBwcHBwcHBwcHBwcHBwcHBwcHBwcHBwcHBwcHBwcHBwcHBwcHBwcHBwcHBwcHBwcHBwcHBwcHBwcHBwcHBwcHBwcHBwcHBwcHBwcHBwcHBwcHBwcHBwcHBwcHBwcHBwcHBwcHBwcHBwcHBwcHBwcHBwcHBwcHBwcHBwcHBwcHBwcHBwcHBwcHBwcHBwcHBwcHBwcHBwcHBwcHBwcHBwcHBwcHBwcHBwcHBwcHBwcHBwcHBwcHBwcHBwcHBwcHBwcHBwcHBwcHBwcHBwcHBwcHBwcHBwcHBwcHBwcHBwcHBwcHBwcHBwcHBwcHBwcHBwcHBwcHBwcHBwcHBwcHBwcHBwcHBwcHBwcHBwcHBwcHBwcHBwcHBwcHBwcHBwcHBwcHBwcHBwcHBwcHBwcHBwcHBwcHBwcHBwcHBwcHBwcHBwcHBwcHBwcHBwcHBwcHBwcHBwcHBwcHBwcHBwcHBwcHBwcHBwcHBwcHBwcHBwcHBwcHBwcHBwcHBwcHBwcHBwcHBwcHBwcHBwcHBwcHBwcHBwcHBwcHBwcHBwcHBwcHBwcHBwcHBwcHBwcHBwcHBwcHBwcHBwcHBwcHBwcHBwcHBwcHBwcHBwcHBwcHBwcHBwcHBwcHBwcHBwcHBwcHBwcHBwcHBwcHBwcHBwcHBwcHBwcHBwcHBwcHBwcHBwcHBwcHBwcHBwcHBwcHBwcHBwcHBwcHBwcHBwcHBwcHBwcHBwcHBwcHBwcHBwcHBwcHBwcHBwcHBwcHBwcHBwcHBwcHBwcHBwcHBwcHBwcHBwcHBwcHBwcHBwcHBwcHBwcHBwcHBwcHBwcHBwcHBwcHBwcHBwcHBwcHBwcHBwcHBwcHBwcHBwcHBwcHBwcHBwcHBwcHBwcHBwcHBwcHBwcHBwcHBwcHBwcHBwcHBwcHBwcHBwcHBwcHBwcHBwcHBwcHBwcHBwcHBwcHBwcHBwcHBwcHBwcHBwcHBwcHBwcHBwcHBwcHBwcHBwcHBwcHBwcHBwcHBwcHBwcHBwcHBwcHBwcHBwcHBwcHBwcHBwcHBwcHBwcHBwcHBwcHBwcHBwcHBwcHBwcHBwcHBwcHBwcHBwcHBwcHBwcHBwcHBwcHBwcHBwcHBwcHBwcHBwcHBwcHBwcHBwcHBwcHBwcHBwcHBwcHBwcHBwcHBwcHBwcHBwcHBwcHBwcHBwcHBwcHBwcHBwcHBwcHBwcHBwcHBwcHBwcHBwcHBwcHBwcHBwcHBwcHBwcHBwcHBwcHBwcHBwcHBwcHBwcHBwcHBwcHBwcHBwcHBwcHBwcHBwcHBwcHBwcHBwcHBwcHBwcHBwcHBwcHBwcHBwcHBwcHBwcHBwcHBwcHBwcHBwcHBwcHBwcHBwcHBwcHBwcHBwcHBwcHBwcHBwcHBwcHBwcHBwcHBwcHBwcHBwcHBwcHBwcHBwcHBwcHBwcHBwcHBwcHBwcHBwcHBwcHBwcHBwcHBwcHBwcHBwcHBwcHBwcHBwcHBwcHBwcHBwcHBwcHBwcHBwcHBwcHBwcHBwcHBwcHBwcHBwcHBwcHBwcHBwcCJ9LCJ0eXBlIjoicXVlcnkifSwic2lnbmVkIjoiZXlKclpYbGZhV1FpT2lKMFpYTjBMWEpsY1hWbGMzUmxjaTB4SWl3aWMzVnBkR1VpT2lKbFpHUnpZUzFxZDNNdE1qQXlOaUo5LmV5Smhibk4zWlhKZlkyOXVkSEpoWTNRaU9uc2lZV3hzYjNkbFpGOWtaWFJoYVd4ZlptbGxiR1J6SWpwYlhTd2laRzl0WVdsdUlqcGJabUZzYzJVc2RISjFaVjBzSW5KbGJHVmhjMlZmYzJoaGNHVWlPaUppYjI5c1pXRnVJbjBzSW1SbGJHbDJaWEo1SWpwN0ltRnVjM2RsY2w5eVpXTnBjR2xsYm5RaU9pSmthV1E2YTJWNU9ubzJUV3RTWlhGMVpYTjBaWEpTZFc1MGFXMWxJaXdpY0dWeWJXbDBkR1ZrWDNOcGJtdHpJanBiSW5WeWJqcHhNbVE2YzJsdWF6cHRiMlJsYkRwc2IyTmhiQ0pkZlN3aVpYaHdhWEpsYzE5aGRDSTZJakl3TWpZdE1EY3RNekZVTURrNk1EVTZNREJhSWl3aWFYTnpkV1ZrWDJGMElqb2lNakF5Tmkwd055MHpNVlF3T1Rvd01Eb3dNRm9pTENKdWIyNWpaU0k2SWxWNE4ydEdVVEp0VXpCaFZuWktNV05RZWs0MFluY2lMQ0p3Y21Wa2FXTmhkR1VpT25zaWFXUWlPaUpvZEhSd2N6b3ZMM0V5WkM1a1pYWXZjSEpsWkdsallYUmxjeTlrYVdWMFlYSjVMMjFsYm5VdFkyOXRjR0YwYVdKc1pTSXNJbkIxWW14cFkxOWpiMjUwWlhoMElqcDdJbTFsYm5VaU9sdDdJbU52Ym5SaGFXNXpJanBiSW0xcGJHc2lYU3dpYVhSbGJWOXBaQ0k2SW5KcGMyOTBkRzhpZlN4N0ltTnZiblJoYVc1eklqcGJYU3dpYVhSbGJWOXBaQ0k2SW5OaGJHRmtJbjFkZlN3aWNtVm5hWE4wY25sZlpHbG5aWE4wSWpvaWMyaGhNalUyT21Ka01EaG1aakl6TUdSbE1HUTRZMlV6TkdSbE9UazVOamRtTjJFNU1EazNPVGc0WWpRNU1EVTRaakJoTWpGa1pETTFZamswTkRSak1qUXdPVGhsTXpVaUxDSjJaWEp6YVc5dUlqb2lNQzR4SW4wc0luQjFjbkJ2YzJVaU9uc2lZMjlrWlNJNkluTnZZMmxoYkM1dFpXRnNMWEJzWVc1dWFXNW5JaXdpWkdWelkzSnBjSFJwYjI0aU9pSkRhRzl2YzJVZ1lTQmthVzV1WlhJZ2RtVnVkV1VnWm05eUlESXdNall0TURjdE16RWlmU3dpY1RKa1gzWmxjbk5wYjI0aU9pSXdMakVpTENKeGRXVnllVjlwWkNJNkluVnlianAxZFdsa09qQmxNVGd6TXpnNUxUQm1NemN0TkdNMVppMDRZelUyTFRGbFlUZGxOVGd4T0dVeE9DSXNJbkpsY1hWbGMzUmxjaUk2ZXlKaFoyVnVkQ0k2SW1ScFpEcHJaWGs2ZWpaTmExSmxjWFZsYzNSbGNrRm5aVzUwSWl3aVpHVnNaV2RoZEdsdmJpSTZleUp3Y205bWFXeGxJam9pYkc5allXd3RjR0ZwY21sdVp5MHdMakVpTENKeVpXWmxjbVZ1WTJVaU9pSnphR0V5TlRZNk4yVm1NU0o5TENKd2NtbHVZMmx3WVd3aU9pSmthV1E2YTJWNU9ubzJUV3RTWlhGMVpYTjBaWEpRY21sdVkybHdZV3dpZlN3aWMybG5ibUYwZFhKbElqcDdJbXRsZVY5cFpDSTZJblJsYzNRdGNtVnhkV1Z6ZEdWeUxURWlMQ0p3Y205bWFXeGxJam9pWldSa2MyRXRhbmR6TFRJd01qWWlmU3dpZEdGeVoyVjBJanA3SW1OMWMzUnZaR2xoYmlJNkltaDBkSEJ6T2k4dlpuSnBaVzVrTG1WNFlXMXdiR1V2TG5kbGJHd3RhMjV2ZDI0dmNUSmtJbjBzSW5SNWNHVWlPaUp4ZFdWeWVTSjkuUnJpNmwwUVN5U3FrOGR1TG43U3FWNjlRTFQyUE5QamN0amVvQU9oV2YxZ2tmdkFRRVREQnVCZ1hnVDJYZXJkX0F0SWRpeldidHFsT1FxNkJTYWVoQ2cifQ"
  },
  "expect": {
    "outcome": "rejected",
    "rejection": {
      "internal_reason": "envelope_string_too_long",
      "wire": {
        "status": "deny",
        "external_reason": "malformed"
      },
      "step": 1
    },
    "comparison": "bytes"
  }
}
