{
  "id": "denial/uniformity-c/budget-exhausted",
  "section": "denial",
  "requirement": [
    "Q2D-C-08",
    "core-model.md#5.2"
  ],
  "description": "A denial/ vector asserting only the two fields the normalized class already fixes. Rejected: comparing them across causes compares two constants.",
  "operation": "process_query",
  "input": {
    "cause": "budget_exhausted"
  },
  "expect": {
    "outcome": "rejected",
    "rejection": {
      "internal_reason": "budget_exhausted",
      "wire": {
        "status": "deny",
        "external_reason": "unavailable"
      }
    },
    "comparison": "bytes"
  }
}
